{
  "id": "EVD-JERUSALEM-TEMPLE70-002",
  "claim_id": "CLM-JERUSALEM-TEMPLE70-002",
  "relation": "supports",
  "evidence_type": "institutional",
  "summary": "Metropolitan Museum scholarship dates the culmination of Titus's siege, sack of Jerusalem, and destruction of the Temple to 70 CE.",
  "source_refs": [
    "SRC-JERUSALEM-MET-WORLD-BETWEEN-EMPIRES"
  ],
  "confidence": 0.99,
  "limitations": []
}
